{
  "candidate_id": "cand_demo_001",
  "source_id": "src_demo_001",
  "source_lane": "article",
  "title": "Structured scoring contract",
  "summary": "Use explicit weighted scoring to rank ideas with auditability.",
  "category": "scoring",
  "claim": "Weighted scoring improves recommendation consistency.",
  "implementation_implication": "Implement deterministic local scoring with fixed weights and gate handling.",
  "problem_solved": "Inconsistent promotion decisions across operators.",
  "proposed_pattern": "Compute weighted score from 8 dimensions and cap by hard gates.",
  "idea_kind": "workflow",
  "confidence": 4,
  "evidence_strength": 4,
  "transferability": 4,
  "expected_upside": 4,
  "risk_reduction_value": 4,
  "implementation_cost": 2,
  "novelty": 2,
  "dependency_burden": 1,
  "needs_validation": false,
  "verification_gaps": [],
  "duplicate_group_key": "scoring_contract_v1",
  "dedupe_confidence": 0.9,
  "registry_match_id": "idea_cand_demo_001",
  "recommendation_state": "implement_soon",
  "recommendation_reason": "base=implement_soon | score=74.8 | dedupe=match",
  "extraction_method": "manual_example",
  "created_at": "2026-04-09T00:00:00Z"
}
